{
  "id": "7",
  "number": 7,
  "title": "现金流量分析",
  "questions": [
    {
      "id": "case-7fca04b18beb-001",
      "title": "第六题(25 分)",
      "chapter_id": "7",
      "topics": [
        "现金流量",
        "现金流",
        "经营成本"
      ],
      "question_type": "案例题",
      "difficulty": "中",
      "background": "第六题(25 分)\n\n某企业拟进行改扩建,采用增量法进行财务分析。项目建设期 2 年,生产期 10 年。建设期\n\n两年内投资比例均为 50%。项目建设投资 30 亿元,其中固定资产 27 亿元,无形资产 3500 万元,\n\n其他资产 550 万元,基本预备费 25950 万元。\n\n生产期第一年生产负荷为 90%,之后各年均达产。达产年流动资金 1.5 亿元(投产年流动资\n\n金 1.39 亿元)。固定资产折旧年限 15 年,采用年限平均法折旧,净残值率为 3%。无形资产和\n\n其他资产原值按 6 年平均摊销,余值为 0。达产年营业收入 15 亿元,经营成本 6.5 亿元(其中\n\n固定成本 1.3 亿元),税金及附加 1100 万元。\n\n各年建设投资及流动资金中资本金所占比例为 30%,其余 70%为借款,建设期借款年利率\n\n5%,按年计息。借款在各年内均匀投入,建设期不考虑本金和利息支付,建设期所产生的利息\n\n在建设期结束时计入借款本金。借款在生产期前 6 年采用等额还本,利息照付的方式偿还。流\n\n动资金在各年年初投入,流动资金借款年利率 4%。\n\n除特殊说明外,上述数值不含增值税。假定项目建设期内投资增值税由老厂抵扣,不考虑\n\n投资增值税影响。项目现金流量年末发生。\n\n(列出计算过程,除 3 问保留两位小数外,其他计算结果保留整数。)",
      "subquestions": [
        {
          "id": "7fca04b18beb-001-1",
          "prompt": "1.计算项目建设期利息。",
          "answer": {
            "reference": "项目建设期第 1 年借款=300000×50%×(1-30%)=105000 万元\n\n项目建设期第 1 年利息=[105000/2]×5%=2625 万元\n\n项目建设期第 2 年借款=项目建设期第 1 年借款=105000 万元\n\n项目建设期第 2 年利息=[105000+2625+105000/2]×5%=8006 万元\n\n项目建设期利息=项目建设期第 1 年利息+项目建设期第 2 年利息=2625+8006=10631 万元",
            "analysis": "【问题】4.判断项目借款偿还期后 4 年利息备付率走势,并说明理由。\n\n\f\n【答案】项目借款偿还期后 4 年利息备付率将逐年增大。理由:借款偿还期后 4 年的息税\n\n前利润均与生产期第 2 年相同,而长期借款利息逐年下降,导致应付利息额逐年下降,所以利\n\n息备付率将逐年增大。\n\n【问题】5.结合上述计算与分析,初步判别项目的偿债能力。除利息备付率外,偿债能力\n\n分析指标有哪些?\n\n【答案】对于正常经营的企业,利息备付率至少应当大于 1,一般不宜低于 2。本项目利息\n\n备付率最低为 4.7 远远大于 2,具有较强的偿债能力,偿债风险较小。\n\n除利息备付率外,偿债能力分析指标还包括偿债备付率、资产负债率、流动比率、速动比\n\n率。",
            "scoring_points": [
              "项目建设期第 1 年借款=300000×50%×(1-30%)=105000 万元",
              "项目建设期第 1 年利息=[105000/2]×5%=2625 万元",
              "项目建设期第 2 年借款=项目建设期第 1 年借款=105000 万元",
              "项目建设期第 2 年利息=[105000+2625+105000/2]×5%=8006 万元",
              "项目建设期利息=项目建设期第 1 年利息+项目建设期第 2 年利息=2625+8006=10631 万元"
            ],
            "pitfalls": []
          }
        },
        {
          "id": "7fca04b18beb-001-2",
          "prompt": "2.分别计算项目生产期前两年的应付利息。\n\n【答案】生产期第 1 年年初的长期借款本金=105000+105000+10631=220631\n\n生产期第 1 年年初的流动资金借款本金=13900×70%=9730 万元\n\n生产期第 1 年应付利息=生产期第 1 年长期借款应付利息+生产期第 1 年流动资金借款应付\n\n利息=220631×5%+9730×4%=11421 万元\n\n生产期第 2 年年初的流动资金借款本金=15000×70%=10500 万元\n\n生产期第 2 年应付利息=生产期第 2 年长期借款应付利息+生产期第 2 年流动资金借款应付\n\n利息=220631×(5/6)×5%+10500×4%=9613 万元",
          "answer": {
            "reference": "生产期第 1 年年初的长期借款本金=105000+105000+10631=220631\n\n生产期第 1 年年初的流动资金借款本金=13900×70%=9730 万元\n\n生产期第 1 年应付利息=生产期第 1 年长期借款应付利息+生产期第 1 年流动资金借款应付\n\n利息=220631×5%+9730×4%=11421 万元\n\n生产期第 2 年年初的流动资金借款本金=15000×70%=10500 万元\n\n生产期第 2 年应付利息=生产期第 2 年长期借款应付利息+生产期第 2 年流动资金借款应付\n\n利息=220631×(5/6)×5%+10500×4%=9613 万元",
            "analysis": "【问题】4.判断项目借款偿还期后 4 年利息备付率走势,并说明理由。\n\n\f\n【答案】项目借款偿还期后 4 年利息备付率将逐年增大。理由:借款偿还期后 4 年的息税\n\n前利润均与生产期第 2 年相同,而长期借款利息逐年下降,导致应付利息额逐年下降,所以利\n\n息备付率将逐年增大。\n\n【问题】5.结合上述计算与分析,初步判别项目的偿债能力。除利息备付率外,偿债能力\n\n分析指标有哪些?\n\n【答案】对于正常经营的企业,利息备付率至少应当大于 1,一般不宜低于 2。本项目利息\n\n备付率最低为 4.7 远远大于 2,具有较强的偿债能力,偿债风险较小。\n\n除利息备付率外,偿债能力分析指标还包括偿债备付率、资产负债率、流动比率、速动比\n\n率。",
            "scoring_points": [
              "生产期第 1 年年初的长期借款本金=105000+105000+10631=220631",
              "生产期第 1 年年初的流动资金借款本金=13900×70%=9730 万元",
              "生产期第 1 年应付利息=生产期第 1 年长期借款应付利息+生产期第 1 年流动资金借款应付",
              "利息=220631×5%+9730×4%=11421 万元",
              "生产期第 2 年年初的流动资金借款本金=15000×70%=10500 万元",
              "生产期第 2 年应付利息=生产期第 2 年长期借款应付利息+生产期第 2 年流动资金借款应付",
              "利息=220631×(5/6)×5%+10500×4%=9613 万元"
            ],
            "pitfalls": []
          }
        },
        {
          "id": "7fca04b18beb-001-3",
          "prompt": "3.分别计算项目生产期前两年的利息备付率。\n\n\f\n【答案】\n\n利息备\n\n付率 \n\n息税前利润\n应付利息额\n\n息税前利润=利润总额+支付的全部利息=营业收入-税金及附加-经营成本-折旧和摊\n\n应付利息额=计入总成本费用的全部利息=长期借款利息+流动资金的借款利息+短期借款\n\n销\n\n利息\n\n生产期第 1 年的经营成本=13000+(65000-13000)×90%=59800 万元\n\n生产期第 1 年的营业收入=150000×90%=135000 万元\n\n生产期第 1 年的税金及附加=1100×90%=990 万元\n\n【注】固定资产原值=固定资产费用+基本预备费+涨价预备费+建设期利息-可抵扣固\n\n定资产进项税额。“项目建设投资 30 亿元,其中固定资产 27 亿元,无形资产 3500 万元,其他\n\n资产 550 万元,基本预备费 25950 万元”。27+0.35+0.055+2.595=30 亿元,故涨价预备费为 0。\n\n“假定项目建设期内投资增值税由老厂抵扣,不考虑投资增值税影响。”,故可抵扣固定资产进\n\n项税额为 0。\n\n生产期第 1 年和第 2 年每年的固定资产折旧额=[(270000+25950+10631)×\n\n(1-3%)]/15=19826 万元\n\n生产期第 1 年和第 2 年每年的摊销额=(3500+550)/6=675 万元\n\n生产期第 1 年息税前利润=营业收入-税金及附加-经营成本-折旧和摊销\n\n=135000-990-59800-19826-675=53709 万元\n\n生产期第 1 年的利息备付率=53709/11421=4.70\n\n生产期第 2 年息税前利润=营业收入-税金及附加-经营成本-折旧和摊销=\n\n150000-1100-65000-19826-675=63399 万元\n\n生产期第 2 年的利息备付率=63399/9613=6.60\n\n【解析】",
          "answer": {
            "reference": "利息备\n\n付率 \n\n息税前利润\n应付利息额\n\n息税前利润=利润总额+支付的全部利息=营业收入-税金及附加-经营成本-折旧和摊\n\n应付利息额=计入总成本费用的全部利息=长期借款利息+流动资金的借款利息+短期借款\n\n销\n\n利息\n\n生产期第 1 年的经营成本=13000+(65000-13000)×90%=59800 万元\n\n生产期第 1 年的营业收入=150000×90%=135000 万元\n\n生产期第 1 年的税金及附加=1100×90%=990 万元\n\n【注】固定资产原值=固定资产费用+基本预备费+涨价预备费+建设期利息-可抵扣固\n\n定资产进项税额。“项目建设投资 30 亿元,其中固定资产 27 亿元,无形资产 3500 万元,其他\n\n资产 550 万元,基本预备费 25950 万元”。27+0.35+0.055+2.595=30 亿元,故涨价预备费为 0。\n\n“假定项目建设期内投资增值税由老厂抵扣,不考虑投资增值税影响。”,故可抵扣固定资产进\n\n项税额为 0。\n\n生产期第 1 年和第 2 年每年的固定资产折旧额=[(270000+25950+10631)×\n\n(1-3%)]/15=19826 万元\n\n生产期第 1 年和第 2 年每年的摊销额=(3500+550)/6=675 万元\n\n生产期第 1 年息税前利润=营业收入-税金及附加-经营成本-折旧和摊销\n\n=135000-990-59800-19826-675=53709 万元\n\n生产期第 1 年的利息备付率=53709/11421=4.70\n\n生产期第 2 年息税前利润=营业收入-税金及附加-经营成本-折旧和摊销=\n\n150000-1100-65000-19826-675=63399 万元\n\n生产期第 2 年的利息备付率=63399/9613=6.60",
            "analysis": "【问题】4.判断项目借款偿还期后 4 年利息备付率走势,并说明理由。\n\n\f\n【答案】项目借款偿还期后 4 年利息备付率将逐年增大。理由:借款偿还期后 4 年的息税\n\n前利润均与生产期第 2 年相同,而长期借款利息逐年下降,导致应付利息额逐年下降,所以利\n\n息备付率将逐年增大。\n\n【问题】5.结合上述计算与分析,初步判别项目的偿债能力。除利息备付率外,偿债能力\n\n分析指标有哪些?\n\n【答案】对于正常经营的企业,利息备付率至少应当大于 1,一般不宜低于 2。本项目利息\n\n备付率最低为 4.7 远远大于 2,具有较强的偿债能力,偿债风险较小。\n\n除利息备付率外,偿债能力分析指标还包括偿债备付率、资产负债率、流动比率、速动比\n\n率。",
            "scoring_points": [
              "付率 ",
              "息税前利润",
              "应付利息额",
              "息税前利润=利润总额+支付的全部利息=营业收入-税金及附加-经营成本-折旧和摊",
              "应付利息额=计入总成本费用的全部利息=长期借款利息+流动资金的借款利息+短期借款",
              "生产期第 1 年的经营成本=13000+(65000-13000)×90%=59800 万元",
              "生产期第 1 年的营业收入=150000×90%=135000 万元",
              "生产期第 1 年的税金及附加=1100×90%=990 万元"
            ],
            "pitfalls": []
          }
        },
        {
          "id": "7fca04b18beb-001-4",
          "prompt": "4.判断项目借款偿还期后 4 年利息备付率走势,并说明理由。\n\n\f\n【答案】项目借款偿还期后 4 年利息备付率将逐年增大。理由:借款偿还期后 4 年的息税\n\n前利润均与生产期第 2 年相同,而长期借款利息逐年下降,导致应付利息额逐年下降,所以利\n\n息备付率将逐年增大。",
          "answer": {
            "reference": "项目借款偿还期后 4 年利息备付率将逐年增大。理由:借款偿还期后 4 年的息税\n\n前利润均与生产期第 2 年相同,而长期借款利息逐年下降,导致应付利息额逐年下降,所以利\n\n息备付率将逐年增大。",
            "analysis": "【问题】4.判断项目借款偿还期后 4 年利息备付率走势,并说明理由。\n\n\f\n【答案】项目借款偿还期后 4 年利息备付率将逐年增大。理由:借款偿还期后 4 年的息税\n\n前利润均与生产期第 2 年相同,而长期借款利息逐年下降,导致应付利息额逐年下降,所以利\n\n息备付率将逐年增大。\n\n【问题】5.结合上述计算与分析,初步判别项目的偿债能力。除利息备付率外,偿债能力\n\n分析指标有哪些?\n\n【答案】对于正常经营的企业,利息备付率至少应当大于 1,一般不宜低于 2。本项目利息\n\n备付率最低为 4.7 远远大于 2,具有较强的偿债能力,偿债风险较小。\n\n除利息备付率外,偿债能力分析指标还包括偿债备付率、资产负债率、流动比率、速动比\n\n率。",
            "scoring_points": [
              "项目借款偿还期后 4 年利息备付率将逐年增大。理由:借款偿还期后 4 年的息税",
              "前利润均与生产期第 2 年相同,而长期借款利息逐年下降,导致应付利息额逐年下降,所以利",
              "息备付率将逐年增大。"
            ],
            "pitfalls": []
          }
        },
        {
          "id": "7fca04b18beb-001-5",
          "prompt": "5.结合上述计算与分析,初步判别项目的偿债能力。除利息备付率外,偿债能力\n\n分析指标有哪些?\n\n【答案】对于正常经营的企业,利息备付率至少应当大于 1,一般不宜低于 2。本项目利息\n\n备付率最低为 4.7 远远大于 2,具有较强的偿债能力,偿债风险较小。\n\n除利息备付率外,偿债能力分析指标还包括偿债备付率、资产负债率、流动比率、速动比\n\n率。",
          "answer": {
            "reference": "对于正常经营的企业,利息备付率至少应当大于 1,一般不宜低于 2。本项目利息\n\n备付率最低为 4.7 远远大于 2,具有较强的偿债能力,偿债风险较小。\n\n除利息备付率外,偿债能力分析指标还包括偿债备付率、资产负债率、流动比率、速动比\n\n率。",
            "analysis": "【问题】4.判断项目借款偿还期后 4 年利息备付率走势,并说明理由。\n\n\f\n【答案】项目借款偿还期后 4 年利息备付率将逐年增大。理由:借款偿还期后 4 年的息税\n\n前利润均与生产期第 2 年相同,而长期借款利息逐年下降,导致应付利息额逐年下降,所以利\n\n息备付率将逐年增大。\n\n【问题】5.结合上述计算与分析,初步判别项目的偿债能力。除利息备付率外,偿债能力\n\n分析指标有哪些?\n\n【答案】对于正常经营的企业,利息备付率至少应当大于 1,一般不宜低于 2。本项目利息\n\n备付率最低为 4.7 远远大于 2,具有较强的偿债能力,偿债风险较小。\n\n除利息备付率外,偿债能力分析指标还包括偿债备付率、资产负债率、流动比率、速动比\n\n率。",
            "scoring_points": [
              "对于正常经营的企业,利息备付率至少应当大于 1,一般不宜低于 2。本项目利息",
              "备付率最低为 4.7 远远大于 2,具有较强的偿债能力,偿债风险较小。",
              "除利息备付率外,偿债能力分析指标还包括偿债备付率、资产负债率、流动比率、速动比"
            ],
            "pitfalls": []
          }
        }
      ],
      "sources": [
        {
          "source_id": "7fca04b18beb",
          "file_name": "08.21年真题解析（三）.pdf",
          "pages": [
            1,
            2,
            3
          ]
        }
      ],
      "exam_ids": [],
      "needs_review": false,
      "review_notes": []
    },
    {
      "id": "case-474a02074724-001",
      "title": "题型模块四、融资分析",
      "chapter_id": "7",
      "topics": [
        "现金流量",
        "现金流",
        "净现金流"
      ],
      "question_type": "案例题",
      "difficulty": "中",
      "background": "题型模块四、融资分析\n\n习题(一)\n\n甲市政基础设施公司(甲公司)计划投资建设A项目,项自建设投资估算额230000万元,并委托某咨询公司提\n\n供融资咨询服务。\n\n咨询公司对A项目设计了如下融资方案:(1)将甲公司的两项资产B和C打包,进行资产证券化出售,筹得的资\n\n金先偿还甲公司当前到期债务,剩余资金全部用于A项目的建设投资;(2)A项目建设投资的不足部分为银行\n\n贷款,综合贷款年利率为5%,按年付息。\n\n乙基金公司计划购买B和C资产包支持证券。基金经理在研究该项目投资的可行性时,研究了B和C资产包的质\n\n量,没有分析甲公司的整体信用水平。\n\n已知,甲公司无优先股,普通股资金成本为8%,适用所得税税率为25%,当前到期债务本息为90000万元。资\n\n产B和C均可继续经营10年,各资产所得税后净现金流量,如表6-1所示,资产B和资产C预期的所得税后投资\n\n收益率为6%。项目现金流量按年末发生计。\n\n表6-1资产B和C所得税后净现金流量(单位:万元)\n\n年份\n\n资产B\n\n资产C\n\n1年\n\n10000\n\n6000\n\n3年\n\n11000\n\n7000\n\n4~10年\n\n12000\n\n8000\n\n2年\n\n11000\n\n6000\n\n表6-1复利系数表\n\n6%\n\n3\n\n2.673\n\n3.1836\n\n4\n\n3.4651\n\n4.3746\n\n5\n\n4.2124\n\n5.6371\n\n6\n\n4.9173\n\n6.9753\n\n7\n\n5.5824\n\n8.3939\n\n8\n\n6.2098\n\n9.8975\n\ni\n\nn\n\nP/A\n\nF/A",
      "subquestions": [
        {
          "id": "474a02074724-001-1",